comment,label
整体内容相对基础，但是对于长时间不用C  进行编程的同学来讲，用来作为练手和熟悉C  编程的操作还是很不错的！希望试题难度可以稍微增加一些！,0
强烈推荐！自学效果很好,1
老师讲得特别详细，赵老师答疑很及时，不会告诉你问题具体出在什么地方，但经过仔细思考获得的成就感十足，之前以为坚持不下去了，但一路慢慢走来，已经挺过12周了，胜利就在眼前。,1
老师讲解的很好很到位，很多细节问题都指了出来。同时测验与作业也设置的很不错。,1
挺好用的，而且方便,1
必修课期末有20分要来自于关注这个课程的账号数量，注册一个关注一个得一分。老师宁可真是个大善人呢，让同学们省去了多少学习的时间，最喜欢这种弄虚作假形式主义了，奥力给！,0
什么东西啊，我看完一直显示1学时?,0
刷课之后没有进度，bug太多,0
这个网课特别好。用通俗易懂的图像语音文字给我们上了计算机课，尤其是老师们极其棒，让我们在乐趣中探索到计算机的奥妙，让我们学习到其中的乐趣。我喜欢这个网课，解决了很多我以前不懂的难题，值得推荐。,1
老师讲解非常细致入微，让我完善了很多课堂上没有得到的知识,1
"""""""1. 工具资源多元化:MOOC 课程整合多种社交网络工具和多种形式的数字化资源,形 成多元化的学习工具和丰富的课程资源。2. 课程易于使用:突破传统课程时间、空间的限制,依托互联网世界各地的学习者在 家即可学到国内外著名高校课程。3. 课程受众面广:突破传统课程人数限制,能满足大规模课程学习者学习。""""""",1
课程很不错，对自己帮助也挺大的，课件很好。,1
视频的这种方式可以重复观看，任何地方都讲得很细,1
听过后，感觉学到很多,1
后悔没有早点听到这样的课程，从无到有的诠释了计算机怎么工作的,1
念ppt都念错，最烂的复变函数之一,0
知识传授f非常透彻，有拓展，但是有的老师吐字不清。,0
在线观看，网页 APP 电脑 手机都可以看，随时都可以学习，很好,1
补充了平时上课时的漏洞，对知识的总结也更加全面了。,1
喜欢这种讲课清楚有条理的   每个知识点都写的非常清楚和工整  有实例来讲解   非常有助于理解,1
很不错 对学习的帮助很大,1
这门课程有很多惊喜 不愧是华科王牌课程 自学学会了 也是我第一个把课全程看完的内容,1
很棒，很强，很厉害,1
掌握了许多知识，收获丰富,1
课程体验非常好，对拓展知识面非常有益。,1
课程内容很丰富，学完感受很深,1
课程安排很不错，希望题能更接近课程内容,1
很好 ，学到了很多知识。,1
又学到了好多新知识，谢谢老师的讲解！,1
学习有点累，但这就是我的路,1
现在还在前期学习，期待后面有实际操作的课程,0
搞互评就是脑子有问题，互评公平性从何而言。总有极少数同学随意打分,0
学到很多东西，帮助很大。,1
没课？？？？？,0
考试时传图片耗费了将近半个小时,0
课程简直完美，让我对计算机有了清晰的认识,1
1、教师通过对课本的独到深入的讲解，达到了很好的教学效果，能结合多种教学手段，使学生对知识的掌握更深刻。教学内容重点突出，教学目的十分明确。2、老师在授课中，内容深且广，涵盖面广，能联系古今，结合时代背景。教师的教学效果极佳，可以使同学在领略知识魅力的同时提高自己实际技能。教师教课内容广大博深，高质量，高效率。教课内容新颖，独特，有个性。,0
老师很负责，讲课很认真，在讨论区域上解答很详细。,1
感谢老师的劳动，感激老师的努力；我很受益，感恩。。。,1
选题很好，内容丰富，要是更注重具体内容是否能被学生理解，更好了,0
这门课对我的帮助很大，感觉非常好,1
感觉非常好 很有帮助,1
"""""""通过这一学期,我学会了计算机的基本操作,学会使用Word,Excel,以及PPT的使用,让我在学习和工作中都得到很大的方便.""""""",1
很好的，可有  内容很好,1
课程的讲授风格 是 我喜欢的。有理论有实操,1
这课真的太好了，讲了很多以前不知道的知识,1
说话说不清楚,0
给我带来了很多，对算法方面的很感兴趣,1
执鞭作伴饿狼，枕边弹雨激昂。英雄终将落幕，魔笛永不绝响。,1
《计算机科学导论》课程很精彩，老师讲的通俗易懂，易于学生理解掌握，课件精制细致、覆盖面广，练习题也有力地抓住要点，使学生掌握知识点更牢固。,1
很好，讲解很细致。,1
很棒，能学到很多东西,1
内容丰富，实际可靠,1
授课内容组织的相当好，老师讲课引人入胜，基本上听了课，然后就可以进行练习了，作业、习题及测试设计合理，总之，目前对该课程相当满意,1
思想为主，明确目标，软件使用作为辅助手段，得到想要结论,1
不要在视频播放中总弹出问题，这样会打扰大家观看,0
学习过程很愉快，课程很丰富,1
卡卡卡，卡得要命。qq登录加载不出来，浪费时间。赶紧优化。,0
内容很好，知识点很详细,1
很好呢，老师们说了很多实用的知识,1
这个课讲的很细，老师上课都是水过去的，这个课让我清晰多了,1
课程很有体系化，收获良多,1
提交考试经常出bug,0
非常失望，学了一学期就是因为线上考试网站出现问题，分数才这么低。,0
真的有用 帮助我很好地理解大学计算机,1
很全面，对于启发初学者的思维，吸引初学者的兴趣很有帮助！,1
测试有错题。。。。。,0
课程很好，内容华而实，老师讲的也不错。,1
进度提示条太单一，无法区分已学和未学的内容，导致网络卡顿造成的学习过的内容无法显示,0
挺好的  利用闲暇时间获得知识,1
讲课很明白，课后练习帮助巩固知识。,1
很有用，了解很多信息,1
说好的阿里证书，最后什么都没有，也没有人出来回应，属实吃相难看,0
李教授讲解的很好，一直在学习,1
内容很基础 不够细致 希望可以讲得更全面一点,0
"""""""转行IT两年, 发现计算机基础是以后提升自己的基础, 要是之前学的就是计算机软件就好了!""""""",1
讲的很好，深入浅出，易懂易学。,1
老师讲的很仔细，且重点突出，通俗易懂。,1
我觉得学习计算机能够提升我们对计算机的认识。同时，也能够让我们对互联网有新的了解。计算机能够方便我们的生活，也能在学习上帮助我们。,1
老师讲解很详细，内容也十分全面,1
很不错，找到了很多灵感,1
此次课程让我受益匪浅，为我学好c语言打下了一个很好的基础,1
受益匪浅，感谢老师,1
为什么看了这么久 一直显示我只看了四分钟 气死我了,0
老师讲的很棒，课程的顺序设置较书本略有不同，但引导性很强，好评！,1
内容讲的生动易懂  很好,1
授课挺俗易懂，适合基础有待提高的学生。,1
课程内容十分充实，老师讲课都很认真，结合课堂学习很有用.,0
课程组老师认真负责，讲解细致。答疑区老师都尽心答疑，非常好。感谢！,1
草拟吗，都快期末了，突然不给答案了，日你个仙人板板。,0
更加了解计算机，为以后工作打基础,1
很好的一门课 让我掌握了更多计算机知识,1
声音小，有点听不到，课程质量好,0
让我对计算机了解了很多，不再停留在打游戏上，,1
授课思路清晰，问题导向，由总体至细节。,1
老师讲课十分生动 细节都非常清晰 讲得很好,1
我觉得超级好诶，完全可以理解，讲的真棒,1
通过本次学习，自己也学到很多，希望今后继续努力，通过学习不断充实自己,1
秦老师的课讲的娓娓道来，深入浅出，绝对金课！秦老师可以开师资培训班了。,1
感觉挺好的，很受益,1
电脑和手机不同步挺烦人的，别的还可,0
授课方式新颖，老师讲解清楚明了，总之非常好。,1
刘宏伟老师讲解的特别清楚，非常专业，特别感谢；如果学生时代能看到这个视频，就更好了，希望好课程让更多的人受益。,0
课程十分有趣，老师的教学方法也丰富多样，收获很大。,1
这门课对我来说意义很大！对我很有帮助！,1
讲的很好，收获很多,1
挺好的，课程丰富，帮助大,1
老师讲的很好，有问题提出的话也会回复的很周到,1
内容很充实，受益匪浅,1
内容很丰富，对我很有帮助，感觉受益匪浅，学到了很多有用的技能。,1
学习内容紧跟时代，对计算思维有了进一步的了解，值得推荐！,1
对刚入门的我来说很有用，加油！,1
老师讲的真的太太太太好了，讲的非常的详细！,1
老师讲话超温柔！！！,1
讲解细致深入，受益匪浅。,1
合理的模式，优秀的资源，让我受益匪浅,1
不太好用，用不明白，那个评分有问题,0
没举例子，太难懂了吧,0
怎么第十周，没有第六节,0
内容精确详细，可以有力提高计算机水平,1
帮助我学会一些简单的计算机用法，并且对我们的以后的学习和工作有很大的作用。,1
能学到很多内容，棒,1
老师讲的很棒，很多课件看不懂的地方经过老师讲解就很清晰了，感谢老师开设这门课程，能够接触到这么好的计算机知识学习。,1
不错，专业知识很到位,1
计算机科学导论这个课程，刷新了我对计算机专业的认识，我没有想到原来程序只是计算机的一部分而已。还有，这个课程很好的引导我向着思维的方向去理解计算机。,1
毫无帮助，一个体育课搞这么多视频出来，上体育课又不给时间看慕课视频，都在拍视频和课堂互动，这些视频要课余时间看，一个体育课要占用这么多时间合理？？？,0
感觉学到了好多，自己还有很多去学习知识。,1
这就很棒呀，很喜欢。,1
老师讲的课很清晰，明了。易接受，非常好！！！！！！！！,1
太好了，我学到了很多。,1
学习生活十分充实，就是没有女朋友。,1
挺好的!说话内容听得懂!,1
别总是照着课本读行不,0
很好，学到很多东西，受益良多,1
授课方式还是需要结合线下！！,0
内容丰富 知识点准确 老师讲课生动,1
我觉得很好·而且可以好好锻炼计算机的一些基本操作,1
挺好的，老师很优秀，。,1
在组原课程收获非常大，老师讲的非常清楚，ppt制作用心。配套实验和课程结合紧密，课上没听懂或者有些模糊的知识，因为做实验的需要促使去看书复习，并在实验中进行实现之后清晰了很多，起到了促进课堂知识吸收的作用。并且实验资源制作非常精良，设计了测试电路，在设计调试的过程中非常方便，节省了很多时间，将更多的精力放在设计调试上，而不是毫无头绪的找错误上。,1
老师很好，内容十分丰富，有助于我们了解计算机网络的原理,1
挺好的，上课讲的挺全面。,1
互评机制真恶心,0
学习的方向更加清晰，知识更明确了,1
该课程详略适中，难易得度，适合本科阶段结算及相关专业的同学进行学习，无论是自学还是伴随自身学校课程学习都是大有裨益的。如果有幸能完成配套实验，学习程度又将上一个台阶。,1
知识讲解的很详细，学习的很有效,1
通过学习，感觉自己了解了好多知识，受益匪浅。,1
讲的很详细 举例子 更加容易理解程序,1
学完了 证书没发,0
只对着书上念，根本没有扩展，不行,0
录音上传不了,0
不知不觉间，已经用了一学期的大学生慕课了，刚开始自己不太理解，到后来的学习过程，学习到了很多‘希望以后还能深入了解学习这方面的内容。,1
课程从介绍计算机的演变过程开始，讲述了其发展历程，了解历史，才能更好地理解现在技术，才能更好地创新,1
教师教授风格益于学生接受，很好,1
普通话 都讲不好，怎么听课啊，听着难受,0
你好，申请了证书，为何都快过去两个月了，还没有信息呢,0
非常好，很感谢河西学院的老师！！！！,1
课程内容丰富，讲解通俗易懂，而且实用案例很多，对我帮助良多。,1
了解计算思维和基本内容，了解社会需求和难解问题，能举一反三，终身学习,1
上课方式太过单一，比较强制，互动性不强,0
"""""""""""""""P700被光能激发后释放出来的高能电子沿着A0 A1 4Fe-4S的方向依次传递""""""",0
授课内容丰富，讲课时举例形象生动,1
挺好的，如果有字幕就更好了,1
学到很多，对考试有帮助,1
全是0分？？？,0
挺好的，学到了很多，但由于本身内容难度较大，还需让我们形象记忆,1
钱老师谢谢你，讲的特别好，举例生动形象，英语用的恰到好处，我真的学到了知识，谢谢钱老师。,1
课程讲的很详细，很适合入门，非常感谢老师,1
我 时间少，尽量往前追干吧。,1
让我有很多不懂的地方都弄懂了。,1
课程对我有很大帮助。,1
讲题的时候能不能把电路图在解析的那一页加上，要不然还要画下来或者翻来覆去的看,0
卡死了    还有能不能出一个可以看到底哪里没看的东西啊  我都不知道哪里我学过了哪里我没学  不是  35个最后一个在哪里  一直34  我都看了好几遍还是34？？？？   系统是不是不行了？？,0
计算机网络专业是设计的职业岗位比较多，专业能力比较强，专业知识比较广的专业。随着经济的发展，社会对计算机网络专业人才的需求越来越大，要求也越来越高，与此同时，一般性的计算机网络专业实际操作能力难以满足就业市场对技能型人才的要求。传统的计算机网络专业课程的教学评价体系已经不能很好地满足当前计算机教学的实际需求。为了提升学生就业竞争力，提升专业技能水平，应该建立以就业为导向，以能力为基础的考核评价机制。,1
作为一个小白，能跟随老师的思路循序渐进，再加上多练习，多思考，可以把学到的知识运用到自己的专业领域。,1
作业是真多，搞不懂整那么多作业干啥,0
内容清晰，思路明确,1
计算机基础课程，帮助学习计算思维,1
最后课程考试明明做了，结果没有成绩？,0
讲的很详细，也很形象，非常棒啊,1
为什么一直不显示学习时长和学了多少课时,0
作为一名文科生，这门课程让没有什么计算机基础的我了解了许多计算机的基础知识，有利于提升我的综合能力，也锻炼了我的计算机思维。,1
一开始有点听不下去，但是学进去了之后发现讲的很好的,1
差劲差劲差劲,0
好好好好好好好好好好好好好好好好好！,1
网上学习很有效  学会了很多东西,1
很好 继续加油 一定可以,1
老师你为什么给了成绩，又给删掉了，你这样不觉得过分吗,0
战老师讲解内容全面，讲述细致，章节编排由浅入深，便于理解，每一章的课后题都亲自讲解，让我受益颇多。,1
这个课是上大学以来上过的最好的课，老师太负责了，吹爆大萝卜老师。学完后加深了对计算机最底层硬件逻辑的理解。加上汇编、操作系统的知识，在学完后我对整个计算机有了更加深刻的理解。到现在终于从头到尾大致了解了计算硬件及软件的工作原理。,1
老师讲解很详细，通俗易懂,1
这个通俗易懂，通过实验方式，能快速建立起知识印象和框架，是一门非常好的计算机入门课程,1
讲解精准，受益匪浅,1
请问为什么非要学生互评，有的学生没有电脑就不能互评，得分比别人低，难道要去网吧互评？？？,0
老师讲得太好了，简洁清晰，循序渐进；课件也不错，重点标识清楚，动画形象直观，最后还有小结。,1
各节视频深浅不一，让人听得一知半解,0
太好用了，我学到了很多东西,1
可以很好的规划自己的课余时间，里面的学习计划也可以很好的督促着自己努力学习。,1
讲的比较快，需要有基础，不如imooc,0
为什么没有视频只有课件,0
从头开始学C  ，我觉得老师讲的非常符合我的预期,1
好好好好好ヾ ^_^♪,1
对计算机有了更深的了解，尤其学会了某些软件的应用技术，受益匪浅。,0
很有启发，老师讲课很好,1
课程很好，老师很不错,1
老师讲的很好，条理清晰，吐字精准，我听着很舒服，自己老师的网课实在是听不下去了，没想到有这么好的课，感谢老师,1
不错 老师讲的很好 就是好深奥 小女子对这个好难懂,0
贯通多个知识点，讲解得也很好,1
不错，准备学习一下,1
哈工大，浙江，这两个大学的课都比较好，不像有些大学，就是念ppt，复读机老师，也不知道那些老师的教授是怎么评上的。,0
片面，讨论区题目不好,0
分个期，谢谢,0
太棒了这课，让我了解了计算机的奥妙。,1
该门课程给我影响很大，学会了计算思维的方法。考虑问题前先分析它的困难度和复杂度，对解决问题有很大帮助。,1
课程内容非常好，老师讲解非常到位,1
课程所涵盖知识量很全面和丰富，里面推荐的书籍、案例都非常经典和新颖，很有前瞻性。,1
太好了，我都学习学到哭了,1
深入浅出，简单易懂，与实践相结合,1
教学详细清晰，非常bang。,1
老师授课容易理解！容易吸收！重点讲的详细！棒棒棒！！！,1
感觉慕课非常好用，可以让大学生学习到好多知识,1
还可以  讲的清晰明了,1
只听一节《采薇》，便已出现许多讹误。啥破玩意，课时全看了，时间还不对,0
老师教学严谨，教学方式新颖，让人受益匪浅,1
可以让我学习更多的专业知识。,1
使用方便，学习效率高,1
太棒了 慕课太好了,1
老师讲得细致而不冗余，简单而精干，连我这种完全没基础的也能听懂。讨论的问题提的也很好，要么激发总结思考，要么是前瞻性的预习问题。,1
听了一节课，发现还是要找一个好的大学来读。课程生动。因为特别想要了解计算机的基础知识，之前找了大连理工大学的大学计算机课程。真是一言难尽！没有对比，就没有伤害。课程棒棒哒,1
充分认识了计算机思维与平时思维之间的区别，意识到计算机思维在现实生活中的巨大作用，能够优化解题方法，提高解题效率，是生活变得更好。,1
课件内容很详细，学到了基础的专业知识，为我们以后的课程打基础。,1
讨论了一节课，听不出到底要讲述什么，观点不鲜明,0
受益匪浅，非常棒！,1
内容丰富，知识有价值,1
完全念书，没有必要这样糊弄，真的越来越差了,0
每个课时时间不长，随堂作业可以反复的做，有助于学生加深理解，很不错，每学一小节都有新的收获，不愧是国家精品。,1
老师讲的很好，比较容易理解，但是希望来学习的同学最好有一些8086汇编的基础，数字逻辑电路基础也需要一点点，但是要求不高。,1
好太好了，讲的很精彩,1
念PPT式授课，老师对待教学太儿戏,0
好，好，好，好，好,1
内容可以，前面的知识比较简单，后面主存线路部分就比较难了,0
课程很容易理解，受益匪浅,1
讲的内容很好，就是感觉有一些死板，可以更加灵活一点就好了,0
比较抽象，值得摸索。,1
基本上都能找到自己想要了解的。,1
不希望学生互评，总会出现不认真的人评价认真写的人，分很低的话很失望，毕竟写了很久，分数不真实,0
老师很好，课很实用,1
感觉对计算机有了进一步的了解，对计算机这门课程学起来更有信心。,1
讲得很明白啦，知识都是一点一点积累起来的，认真听下去～,1
老师讲课条理清晰，课件有条有理，收获很大,1
内容丰富，收获很大。,1
在计算机科学导论的课程中，学到了很多新的知识。这门课对于后续的学习是非常有帮助的。,1
为什么不出总成绩就关闭了课程，老师说我们没有成绩截屏就算没学，希望给个回复,0
破东西 我全都学了，但就是不增加学时！老师认为我没学！软件的锅凭什么让学生背！！！我都想彪脏话！！！！！,0
授课方式新颖，听课效果好，交流积极及时。,1
讲的很详细，很适合零基础学习,1
那个选错了可以退掉吗？,0
这老师没吃饭吧，说话没气了？,0
大学计算机你学的虽是基本，但学会了很多,1
超级棒！！！我们老师上网课放这个视频！！！,1
很好的呀，这些课程都很有用,1
很详细，对零基础很友好,1
非常好，风趣幽默，化腐朽为神奇,1
还行，除了知识点多而杂，讲得不错,1
老师讲的很好，要是老师口头说的内容，能PPT多一点展示，就跟好了。,0
我修养太低，好多地方的奥妙我欣赏不了，譬如止戈为武,0
内容丰富，讲课吸引人,1
为什么到现在到没有成绩,0
在学习中遇到的问题可以得到解决。,1
一整放网课视频就卡住 完了再放就从头 不给计进度,0
让我学会了如何使用计算机，使我受益匪浅。希望慕课可以越做越好！,1
课堂形势无聊,0
还行一般 主要是网课作业太多 截止时间不合理 造成很多麻烦 建议整改,0
老师的教学很清晰，思路条理简单易懂，让我从中学到了很多知识，受益匪浅。,1
老师教的很好这没的说，但是在4.9Cache地址映射这一节课中7分钟之后的讲解，为什么要给我们看ppt，一张图摆在那里看不见老师，光听老师在那里说，在讲什么位置的东西都不知道,0
课程学习起来很好，讲的很基础仔细，尤其还提供课件，方便课后巩固，另外的话每章的例题也很好，可以模仿着进行写作业。赞！,1
还不错哦，对我来说坚持就是一种学习，一种进步。,1
通过本门课程我对计算机所涉及的内容有了一个总体的认识，也了解了学科的一些的核心思想和方法。,1
为自己带来了许许多多的收获，拓宽了视野，加深了对计算机的认识。相信在未来的道路上会有更加优异的表现！,1
感觉没什么用处，差评,0
老师是讲得非常好，可以说是网络上见过最好的计算机组成的课程了，之所以给4星，是因为ppt做的不太好，听老师讲课只能靠着想象老师讲得某些 部件，比如说老师 讲磁盘的结构的时候，要是没看过图像，肯定想不出老师讲得是什么样子的。小声的：希望老师能找些人来把ppt做好，日过可以的话，那就是真的很完美了。,0
很好，感觉能够更好的了解计算机,1
挺好的，学到了很多东西,1
非常好，我学到了很多,1
老师讲的非常仔细，我从这门课程中学习到了许多关于计算机组成原理的知识。,1
学习进度没有及时反馈，学生不知道完成了那些要做的作业，任务一直完成不了,0
貌似有点慢,0
为什么看完没有记录呀,0
秦教授专业功底深厚，课程准备充分。讲解非常到位，货真价实的国家精品课。,1
没有解析啊  老师  校长同志,0
课程内容丰富、授课方式新颖，老师讲解透彻清晰，感觉对我的影响很大。,1
内容翔实，讲课方式新颖,1
软件有毒，打不开课程，一直在那里转啊转啊转啊转,0
赵老师讲得不错，这个女老师讲得不行啊，录音质量不好而且照本宣科,0
很差，不显示哪里看，看完了还显示没看完,0
课程较难，但视频详细认真。老师也推荐了相关书籍让我们去翻阅学习。,1
学习进度条都不更新的,0
很好，老师教的很有用，让我对计算机有了基本了解,1
分数都给我了82分为什么不给我证书?,0
概念讲解不清晰，案例不够多。,0
厉害   。。。。,1
很厉害啊，老师讲的也很清楚,1
课程易于理解，讲解非常清楚。,1
课程非常系统，老师讲解得很清晰。,1
由于工作，需要学习tcp/ip协议，感觉钱老师讲的通俗易懂；静心听讲，会对网络有进一步的理解。,1
内容讲的挺好，非专业人员也能听懂一部分，讲解方式比其他精品课程好，清楚明了，灵活。值得推广学习。,1
课件内容充实，节奏紧凑，讲解老师声音洪亮清晰。部分背景图片与色彩较多，易出现视觉疲劳。,1
还是不够清楚，细致，难理解。,0
简洁但是很直观清晰！,1
内容挺好的，就是讨论区不太完善,0
计算机思维导论课程讲述了许多计算机的概念，从计算之树，符号化、计算化、自动化，到组合抽象与构造，再到冯诺依曼计算机和现代计算机的讲解。然后讲述了语言。可以说，让我对计算机和计算思维的了解更进一步，也更好地激发学习计算机的兴趣。,1
非常好，通俗易懂，越听越想听,1
好好学习，起早贪黑,1
内容充实，挺不错的,1
