comment,label
预备知识稍微有点欠缺，不过总体上老说是超好的课程，我很喜欢这种从原理讲起的课,0
闪退，已学课程不能记录,0
内容完善全面，师生互动增强学习交流,1
还可以吧，看完的视频没有进度,0
内容丰富，讲解透彻，超级喜欢,1
照着ppt读？给喵爬,0
点击左下角的“开始”图标、“所有程序”、“附件”、“截图工具”。　　2、右键单击“截图工具”，选择“发送到”、“桌面快捷方式”。　　3、在桌面上右击“截图工具”的图标，选择“属性”，在“截图工具属性”对话框中，点击“快捷方式”选项卡，再点击这个选项卡页面上“快捷键”设置的位置，默认会出现“Ctrl Alt ”，可以在后面加上任意字母键或数字键，如“Ctrl Alt X”，点击应,1
老师讲的很精彩，但是实在有些难懂。,0
很好，老师水平高，易听懂,1
老师讲课通俗易懂，讲案简介明了，重点突出，很容易就懂了,1
单元测试截止时间不一样？！,0
哈工大超优秀，战神超优秀,1
为什么给我这么低分，全部视频都看完了,0
老师辛苦了，非常棒的课程。,1
还是不理解为什么三月底就要期末？老师又不讲，第一遍就没学清楚，快速的几轮翻滚学有什么意义？,0
照本宣科，讲得特别无聊。而且为了蹭课时费这一门课里的讲课老师太多了，几乎一章换一位老师，部分老师的声线听着难受。。。总之如果没有学分需求，不建议外校的听。,0
感觉自身的逻辑能力变强了，思维更加活跃,1
老师说话不清晰,0
老师都很棒！就是有时候有一些siban（hh就是希望有时候不要照着念呀！）,0
很棒，学到了很多。,1
受益匪浅 收获颇丰,1
课程测验和作业不提醒，0点是什么意思，根本就是在坑学生，每天学习任务那么重，有时候登上去纠结束了,0
【和越科技】专业团队运营 纯人工代挂 安全稳定如果你还在担心成绩不高？没时间挂课，挂不完吗？请交给我，一切问题都可以解决！超星尔雅 待看视频   作业   考试 全包 品质保证 包售后安全、效率、保证无不良需要的联系企鹅 【845500906】v信【heyuewangke】,1
学到了好多东西！老师授课超级棒！,1
完美错过小测时间，为啥不早点发布通知，无语凝噎,0
对原著理解偏差很大；理解浅薄，极不深刻。不知《易》，不足以言古代兵法。《易》是灵魂，这些兵法只是皮毛。不知《易》，讲出来的都是空虚。很抱歉，我想对祖先留下的遗产负责。,0
这门课教会了我计算机基础操作。,1
作业没办法做啊，添答案怎么输入,0
本门课程主讲刘教授的讲解过程很透彻，对于知识重点部分讲解细致到位，很容易通过他的讲解弄懂相关计算机各部件的重难点知识。十分推荐！,1
课程很好，能学到很多知识,1
虽然需要扣细节慢慢听，但内容真的不错,1
很好，我学到很多东西,1
学习好累，学到很开心。,1
提高了计算机操作水平，学习了以前没有接触到的计算机知识。,1
本课程教会了我如何使用计算机的一些基本技能和有用的方法。,1
找不到课堂讨论，为什么期末成绩只有百分20？那不考的人也能过？,0
讲的很好，收获很大！,1
讲得很详细，实训操作也比较有代入感,1
挺好的，弥补了我课堂上听不懂的区域,1
非常好，课程的体系结构十分合理，老师讲的十分清楚透彻，省的看大部头的书。,1
我觉得课程的设计非常好，内容非常多和仔细。很适合学生自习时使用，可以很好地预习和温习而且还设有解答，这是非常棒的,1
作为商学院的一名学生，我很有幸能参加本次课程的学习。虽然这门课对于文科的同学来说学起来比较吃力，但通过老师的细心讲解和演示，我受益匪浅，同时也获得了许多有关计算机方面的知识。我相信在本次课程中获得的计算机有关知识一定会在未来发挥重要的作用！谢谢老师！,1
太卡了，学了系统没有更新，说我们没有学,0
好好好，真的很好，让我学到了很多知识,1
讲的有些笼统，没有做到学科的深入化，把这些大多数是常识的东西给一名大三的学生来看在我看来不合适，太简单了,0
感谢战老师，这门课程帮助我从一个大的视角建立了对计算机学科整体的认识，搭建了一个系统的框架，再次感谢战老师及哈工大其他为这门课程付出的老师。,1
老是忘记去做,0
本课程非常简略，明了，学习特别轻松,1
这门课开拓了我的思维，让我收获了许多,1
纯粹照着念，后面还不给课件,0
讲解很到位，学到了很多东西,1
对同性恋问题，只提供负面信息，恶意引导学生的负面情绪，以培养学生对同性恋群体的厌恶！,0
讲的特别好，让我充分了解自己的知识，拓宽了知识面。,1
注册结构工程师报考年限作业答案有误,0
系统我真没话讲,0
系统反应太慢，我看完了视频说我没看，我很无奈,0
非常、非常、非常好！,1
分数构成极为不合理，平时考核总分151分，就因为错了一个选择题总成绩扣了我20分，说好的比重呢？视频也都看了，讨论也写了，所有题都做了，按你这设置期末满分应该是151*0.7+100*0.3,0
课程很充实，知识讲解很细致，学习方法多样化,1
老师讲的很好，但我感觉在听天书,0
学到了许多基础性的关于互联网的知识，拓展了视野,1
非常好 思路清晰 都是重点,1
知识结构有点杂，但是还是能收获到很多的,0
老师讲课没得灵魂,0
战教授讲得非常好，听了很受益。,1
获得了很多军事知识，收益颇丰。,1
这种形式上课非常新颖，我们听课的效果也不错，超级棒！,1
每次都有时间限制真的神烦，老是忘记。讨论也只能在电脑上做，一点也不方便。差评,0
老师讲了以后，我对计算机有了一个清晰的认识，很感谢老师，感谢慕课,1
思路很清晰！很容易听懂。,1
2020年11月24日，该课程被中华人民共和国教育部认定为“首批国家级一流本科课程”。希望计导越来越好。,1
不错，适合学习，拓展技能,1
都说桂电不错，我一看这个目录就知道确实牛,1
内容编排合理、讲课思路清晰、细节讲解完美,1
讲的太好了，强力推荐，清楚的明了程序是如何跑起来的。,1
老师讲的非常棒，细节讲解非常到位，重点突出。,1
非常好，学习了很多,1
最后的大考试太难了。。。这个论文并非针对用户的专业方向，所以个人的观点会有所偏颇并不合适,0
很详细，学到了很多哦,1
很好，很棒，很用心,1
照本宣科，一个例题都不讲,0
系统的教纲，让我收获良多,1
好得很呐  实话好    一家的好事大家的好,1
超级不错 很nice,1
还不错，这门课程让我学到了很多,1
海星，计算机基础使真的难,0
非常号，开始讲解清楚细致，课件内容丰富，对于学习计算机有很大帮助。,0
很棒，学到了不少东西,1
老师讲解很有深度，条理清晰，使我学到了很多知识,1
课程微信扫码根本不提醒进度 害我丢了四课的内容 真的很生气,0
有趣！老师讲解通俗已送，课程内容符合自己兴趣，加深对计算机的理解,1
做完题都没有解析，，，，很难受,0
这门组原课是我学过的最好的组原课，强烈推荐！！,1
强烈推荐，老师讲课很有意思，学习计算机的同学认识计算机组成原理也是很有必要的，五星好评，下次还会再来,1
老师们讲的很好，对计算机的掌握有很大帮助。,1
真是太棒了，我学到了很多知识。,1
课程质量佳，收获满满希望学校的课程建设能越来越好,1
课程知识面很广，实践很多,1
课程体系完整，知识点覆盖面广泛,1
太难了 不会,0
不能连续播放，还要自己点课程,0
课程板块非常清晰，老师讲得非常具体好懂,1
还可以，有点听不懂,1
课程中可以学到很多有用的知识！！！！！1,1
为什么我感觉讲的太少了，书上的很多实现和细节都没咋讲。。,0
我觉得应该把课程设置成永久可见，而不是结束了就不能看，也不能下载。国人需团结，知识传播本身就是一件伟大的事，。你们每次开课，结束后不能看，下次又重新讲也累。,0
计算机思维在生活中给了我很大的帮助。,1
提前领略以后要学习的东西，很不错,1
刘老师讲的很好、很细，知识点讲的很形象化。我会继续学习（下）。谢谢，刘老师。,1
正好缺乏这方面的知识，学习一下,1
8月中旬就上新了，可是一直没有课件是为什么呀,0
通俗易懂并且注重动手能力，获益匪浅，点赞！,1
写个作业一直闪退，没法打字。卸载了重新下了一遍，还是没法打字，我服了。根本没法做,0
计算机给我们的生活带来了乐趣，但基础比较弱，学起来具有一定的难度,1
组织架构完美，很能学到东西,1
老师和蔼可亲，内容生动形象，通俗易懂，深入浅出的介绍了计算机相关知识。,1
讲解的比较详细，全面,1
老师讲得系统，全面。将在课堂上老师没有讲到的知识点讲解得很清楚。,1
内容很丰富，老师讲解很具体，实例很好,1
学习感受很好但是软件有问题有时改不了id,0
本课程对于计算机基础差的我来说，真是雪中送炭。感谢这么多优秀老师的细心指导！！！,1
课程质量不高,0
针对所讲的内容，适当的都给出了合理的例子，并且案例展现十分的精致。,0
老师的课通俗易懂，收获满满。,1
与线下授课相比，我们学生可选择的范围更大了,1
计算思维带给了我很多关于计算的想法，让我以后投身数学学科具有很好的指导作用,1
讲解的很仔细，听的也就很认真，课后练习的编程题，极具锻炼性，可以很好的对所学知识做出回顾。,1
学习到了很多以前不知道的知识，以及关于计算机方面的操作。,1
为什么不能向老师提问了 开玩笑嘛 不会的就问不到人是吗,0
啥玩意，我还以为是我老师有问题，现在发现是这本书编的让人接受不了,0
这门课程不仅让我了解了计算机学科的相关内容，也体会到了计算思维的重要性。该门课程的授课老师董荣胜教授讲课风趣幽默，经常举一些现实的例子解释抽象的概念，帮助我们学习。,1
为什么取消电子证书，还要我们花钱买，辣鸡,0
内容充实，很适合初学者。,1
不错不错，提高了我的思维能力,1
不好啊，，，，作为公选课，信息不通，平台、学校、学生,0
从慕课中学到了很多，不仅培养了我互联网信息检索能力，对现代信息环境的理解能力，以及互动与交流能力，更提高了我的综合素质。可以共享不同学校的宝贵的教学资源，不同于传统的课堂教学，网络教学可以给学生更多的自主学习的空间留出思考和学习的空间，非常不错，高效。,1
老师讲的都特别好，习题也都可以及时巩固上课所学内容。,1
讲的挺烂的，基本就是把课本上公式念一遍，还不如自己看，可能华科的同学也是自学能力太强了，所以这老师可有可无。,0
很好，学的很多有用的东西,1
感觉很棒，学到了很多。,1
打个分还要我写？,0
内容丰富，学到了很多知识,1
只能提交一次...,0
对我用处很大，让我更好地了解计算机,1
好！！！！！！！！！！！！！！！！！！！！！,1
内容充实，收获颇多。,1
优秀，非常适合我们学校的教学,1
了解了计算的由来，组成，发展方向,1
本门课程讲述的特别的通俗易懂，以计算学科的基本问题讲授优先，以经典的案例教学为基础，以习题课和实验课的内容加强学生对学科基础概念的理解，将课堂翻转过来，让我们能够尽快了解学科的概貌，培养了我们的计算思维习惯，对于今后的学习有很大帮助。,1
讲授内容充实，讲解思路清晰，授课方法引人入胜，真是一门极品课程！,1
第四周和第三周跨度有些大，对第四周有些不理解,0
不错，不错，不错。,1
总的来说是比较好的了，学习深度也合适。,1
太多广告，经常卡,0
开课早是一个很好的加分项。,1
绝对是上过的最好的MOOC，课程内容和实践紧密结合，可以很快投入到实验中做出成果，秦院长和大萝卜的讲课很棒、课件非常精美、实验配套的软件和资料也非常齐全，很赞。,1
内容很丰富，但是一直上网课，身体有点受不了,0
内容丰富，受益良多。,1
虽然听说计算机组成原理很难，但是一步步从简到易，慢慢做实验，感觉不懂的东西慢慢清晰了。,1
讲授的知识点很细，可以查缺补漏,1
该课程可以弥补课堂上的不懂得地方，可以查漏补缺,1
恶心到死，声音忽大忽小，开头声音又震死人，听都有困难还学？,0
前面的学习内容拓展了我眼界，很有意思。老师的授课方式灵活一点，多带入感情，讲解时多补充课件之外的内容会更好。,0
太棒了，非常喜欢这门课,1
真的增长了我的见识，完成了我的心愿,1
讲解简单易懂，还没有不懂的地方,1
课程测验时间设置极不合理，易漏做。,0
内容丰富，很大收获,1
老师对待这门课程的教学非常地用心，这是一个非常系统的比较全面的计算机科学导论课。课程中老师与课本带领我们学习计算机中的科学以及应用的方方面面，为我们未来的专业学习奠定了非常好的基础。课程线上线下结合教学，通过计算机科学导论相应实验把在课本上学到的科学理论实际动手运用，这是一个非常有趣的学习过程。老师你们辛苦了!,1
课程内容十分详细面面俱到，我觉得真的可以学到不少东西。,1
很基础，暂时还没有深入，还无法评价是否详细。,1
老师讲的太好了，条理清晰，循循善诱。,1
试题答案错误太多了,0
我觉得这个科目让我们更加了解计算机网络，让我对计算机更加了解。,1
老师讲的超级棒，好好好好,1
让我感受什么是计算思维。,1
上这门课要有一些基础，有些数字电路的东西听着不太理解，还需要后期更加深入地研究一下,0
很棒，可以学到很多东西,1
不错，需要什么书啊,0
传说中的PPT老师，口音特难受,0
内容是乱的，非常麻烦,0
讲的很详细，受益匪浅,1
深入浅出，层次分明，结合虚拟实验更容易理解，紧跟计算机科学的发展应用，令人受益良多,1
进度一直不更新，都不知道该看几遍了,0
你觉得这些给一个学习者 能听得懂么？jemter没声音，操作对应的那个步骤是干嘛的 我刚看能理解？,0
真的是一个超级棒的软件，希望下一届有更多的题，这样就可以学到更多的知识，大家都非常努力的学习！！！！,1
这种方式新颖独特，提升了我学习的兴趣与动力。,1
教会了我很多计算机知识，受益匪浅,1
课程内容有趣，课程诙谐，老师上课很有激情,1
好的大学没有围墙，加油,1
为什么我都做完了任务，也都是满分，没有给我算分数啊？,0
一些操作流程都会演示，而且讲得很清楚，听的还可以,0
很具体，很棒，适合小白,1
课程类容很全面，比较丰富，也有很多的实用性，能够学到很多知识,1
讲的都是紧扣原理，能够帮助学子们更好理解C  ，能够有所创新,1
感觉自己在老师的讲解下学的棒棒哒！！!,1
看了视频不显示啊啊啊,0
课程设置合理，课程内容丰富,1
不好，课程学习进度不更新,0
这门课非常具有实用性，,1
书本编的十分的精彩和有趣，题出的十分抓重点,1
线上学习真的很给力啊，疫情期间慕课对于我们的学习提供的无法比拟的帮助,1
计算思维可以为学习计算机学科其他课程打下基础。,1
教学视频思路清晰，老师教得很好,1
课程条理十分清晰，讲解的很明白。,1
内容很棒，可以记得笔记很多,1
太完美了就是每日回复竟然还有限制,0
差评，这课我实在是,0
内容充实，讲解生动,1
从来没见到过这么认真负责的网课，不仅有pdf还有文档说明，爱了爱了，讲的也非常好，例子也很生动,1
课堂内容很好，编辑者确实花了心思与精神，感谢编辑者们我们才有一个如此好的学习平台。,1
学习有趣，层层递进，非常快乐。,1
讲授的很明白，也有拓展知识，很喜欢。,1
课程比较有趣，还可以。,1
老师讲的干货很多，也很紧凑，由于基础差，我跟的很吃力，但课程是很好的,1
讲解语气和听课气氛比较压抑，很多部分的内容不够细致,0
我做题目，时间给30min ncbi打都打不不开你让我怎么做题？ 零分？,0
不知不觉间，本学期的计算机科学导论课程已经结课，我感到受益匪浅。通过老师细致入微的讲解，使我学习到了很多前所未有的新知识，接触到了不同层面的信息，丰富了知识，拓宽了视野，陶冶了情操，同时也激发了我对其他科目学习的热情。感谢李凤英老师一路以来对我的关怀和照顾，我真的很感动，在离家这么远的地方上学还能遇到这么好的老师。我对老师教学内容非常满意，希望有机会能够再次聆听到她的讲解。,1
毕业已5年并且对程序设计毫无基础的我学着收获满满。真棒！希望学完课程后，能掌握好C  。,1
对于计算思维有了很深的理解，能用来分析生活中的问题,1
老师讲的特别好，对学习这门课的兴趣更加浓厚。,1
学习有收获，更加充实知识,1
收获很大 感觉很有效果,1
讲的知识自习又全面，便于学习,1
嗯，非常棒，超级好,1
很好，提升自身实力,1
差极了，总是崩溃，反馈奇慢无比,0
老师高屋建瓴，讲解的很到位，只是在高级语言上感觉没必要有实验课。,0
在慕课找计算机课程必须是工大，只能说最好，北大都不及。老师实力雄厚、大多为领域专家、有课程出书。老师讲课掷地有声，有特点，深入浅出、思路清晰透彻、有深度更前沿。,1
其实给一星不是说老师们讲得不好，而是整个设计太为难人了，完成作业后还要互评，找不到互评的人，太难了，完成得再好也没有分。,0
觉得挺不错，就是更新太慢。不贴切人，还有就是为什么我明明没有提交考试答案后台没有显示，导致我错过了考试挂科/??/?/????？//////希望能给我一个答案。谢谢。,0
太强了！！！！！！,1
整体感受很好，老师讲的比较细致，举例适当。大学时没好好听，又回来重新打基础来了,1
重点一步到位，简洁易懂,1
有所收获，不过声音有时会比较难听,0
好！对学习很有帮助！,1
课程内容比较完善，老师授课独树一帜。,1
课程讲解细致入微，通俗易懂，课件条理也很清晰，学起来比较轻松，测试题也抓住重点，较好地训练知识点，总的来说课程很不错。,1
"""""""该课程书本很厚,内容丰富详细，不怕你看不完，就怕你看到收获不完！老师教学也很独特，总能把看似复杂的问题转换成浅显易懂的理论知识而为大家所接受。同时，还不忘拓展知识点，认真了你才会发现自己的脑容量不足。""""""",1
好实用，自学时碰到一些类似的内容,1
计算机网络课程提高了我的综合素质 也学到了很多客观和主管的知识。,1
很新颖，老师都讲的很好,1
学习的可以，感觉这个网课挺好的,1
涉及面广，老师讲题清晰,1
课程很丰富，内容很精彩,1
这个课程非常好，很适合我们学习，而且容易学懂,1
卡。。。。。,0
课程内容安排合理，老师讲解清晰，能学到很多东西。,1
"""""""大萝卜,就是好吃!""""""",1
计算机课程教会了我许多有关计算思维的理论，是我能在学习和生活中更好地进行思考。,1
课程特别好！！很有帮助,1
非常棒！老师们讲的都很好！我最喜欢陈宇峰老师~,1
编程能力有了很大的提升，语法方面,1
真的非常棒，老师讲的很详细，提出的问题也可以尽快帮我解决，太优秀了。,1
建议录制课程时，麦克风换个好的，声音不清楚，一卡一卡的,0
老师用简洁的话语和生动地举例来介绍计算思维，使我可以快速得明白。,1
花这些时间做这些题太值得了！,1
可以很方便的学习，不会的可以重复看。讲解得非常细。,1
我作为普通本科院校学生，慕课的出现给我提供了优质的教学资源，我觉得自己获得了和高校学生平等学习的机会。,1
电路这块对跨考生而言，难度略大。,0
这门课程有效的帮助我学习使用计算机，它真是一门不错的课程,1
互评有毛用，一点也不公平,0
作业考试时间安排不合理,0
真的挺不错的一门课程，从细微的讲到宏观的很好,1
泛泛而谈，讲课水平差，思路不连贯，照本宣科，不知道是怎么评上国家精品课程的，强烈建议取消。,0
收获很多，更加细致的了解了什么时计算机。,1
网课的形式更加方便，且不会的地方可反复观看,1
学到的内容较少,0
老师授课的方式非常适合我们，他根据本课程知识结构的特点，重点突出，层次分明。理论和实际相结合，通过例题使知识更条理化。,1
明明回帖的，但是就是差几分及格，,0
课程还不错，老师讲解的还可以，只是不知道有没有最新的课件,0
战老师的课让我受益匪浅，所讲范围涵盖面积大，深度广。,1
授课方式很好，学习模式也很适合,1
课上不懂，网上来凑,1
有些课没有测验，是不重要吗,0
优秀，讲的非常好！,1
课太难刷了，要了我的老命了,0
这门课很虚，毫无意义，不理解为什么为什么要用这种形式来上这门课程，总之很失望。,0
内容充实，非常喜欢,1
老师讲的很棒，必须满分,1
老师讲的真好，计算机体系总体讲的齐全，对我的职业发展有很大的帮助，让我对计算机有了整体的把握。,1
非常非常好，有帮助,1
"""""""课程内容十分精彩，非常丰富，可以学到很多知识，让初学者更加了解有关计算机的一些基本问题,为以后学习计算机方面的技术打下基础。""""""",1
老师能不能举个例子，不照着稿子读,0
了解了计算机相关基础知识 丰富了视野 培养了现代社会的一些基本素养 值得推荐,1
课程清楚，明白，利于学习,1
授课方式多样丰富，具有较高公平性，但学习效果主要依靠学生自觉。对学生学习效果的检验还需要进一步探索。,0
深入浅出，深刻充实,1
课程很好，老师讲解的也很细致,1
老师讲得很细致，练习给的也够多。,0
作业就不能一次性都放出来嘛?期末考试都考完了我还得隔三岔五来看看有没有更新题目？？？,0
满满的收获感，丰富的知识内容，广泛的实际用途 。,1
内容丰富，开拓视野，老师讲的也好，加油,1
很喜欢的，开放的课程更多，课程质量也有个分类就好了,0
完全照着课本念，希望更多的加入一些自己的理解，把上下文串联起来。这个课程不需要听课，看课件就足够了。看吴恩达的机器学习或者周志华的机器学习视频更好。,0
画片在播放时每一帧的图形都被转化为图像而播放出来，所以局部放大会模糊我们一般在网络上下载的图片都是位图图像，由像素点组成，像素点的多少由分辨率决定，在更高的分辨率下观看图片，就会使得像素点放大，看上去像马赛克色块导致图片的不清晰。,0
垃圾，回答问题，只要有党这个字，就不能过审，还让我们怎么回答问题了,0
内容安排合理，各位老师讲的很好，尤其李凤霞老师讲的课，深入浅出，把一个复杂的内容，能够三言两语讲明白，讲清楚，讲透彻，受益匪浅。唯一一点就是每个单元的考试时间日期限制的太死，有时候，像我们这样的课外学习者会忙得搞忘记。,0
老师讲课很细节，内容涉及广，易懂,1
老师讲解周到细致，对个别问题讲解的很棒,1
课程的内容我个人觉得还算简单可能是由于刚开始的原因，我希望以后的讲课也能继续保持这种循循善诱的方式，这样我们便于接受。,0
喜欢老师的授课模式，众里群他千百度，那人却在灯火阑珊处。我看过几个计算机视频。总的来说，告诉你这样做才会，不告诉你就是不会。可是生活计算机遇到的问题，怎么可能像老师讲的那么简单。我学什么都喜欢找规律，找一个为什么这样的思维？可是到做excel时为什么？就是你必须这样做。就是对的。搞得学计算机像鸭子填充法。脑子根本不转。以下希望非计算机专业的学生，也学习学习，毕竟社会需要全能人才。,1
